{
  "version": "1.0.0",
  "entries": [
    {
      "epistemicClass": "durable_compiled_knowledge",
      "authorityRank": 4,
      "visualStability": 6,
      "persistent": true,
      "visual": {
        "form": "solid_celestial_structure",
        "label": "title · compiled <date> · verified <date>",
        "pattern": "faceted opaque surface with continuous edge lines",
        "motion": "slow axial rotation; responds only to compile or scan events",
        "colourToken": "starWhite",
        "tether": "continuous line to every supporting source",
        "interaction": "select opens compiled explanation, claims, tethers, related, supersession history",
        "reducedMotion": "static faceted structure; state shown by edge continuity",
        "lowPerformance": "lower facet count; edge lines and label retained"
      }
    },
    {
      "epistemicClass": "immutable_raw_evidence",
      "authorityRank": 9,
      "visualStability": 9,
      "persistent": true,
      "visual": {
        "form": "sealed_source_artifact",
        "label": "title · path · sha256 prefix · ingestion state",
        "pattern": "closed monolith or tablet with an engraved hash band; never opens, only projects",
        "motion": "none of its own; a light projection may emerge when read",
        "colourToken": "evidenceIce",
        "tether": "target of tethers; never a source of them",
        "interaction": "select shows record, canonical path, hash, provenance, relationships; read creates a projection, never an edit",
        "reducedMotion": "static monolith with projection fade",
        "lowPerformance": "simplified monolith; hash band retained"
      }
    },
    {
      "epistemicClass": "owner_approved_decision",
      "authorityRank": 9,
      "visualStability": 9,
      "persistent": true,
      "visual": {
        "form": "sealed_monument_with_owner_mark",
        "label": "OD id · title · date",
        "pattern": "plinth plus monument with a raised golden seal glyph and a keyed collar",
        "motion": "seal descends once on approval; otherwise still",
        "colourToken": "ownerGold",
        "authorityMark": "owner seal glyph (form), never colour alone",
        "tether": "governed signals radiate to dependent nodes and project surfaces",
        "interaction": "select shows decision, consequences, applies-to, dependents",
        "reducedMotion": "seal appears without descent",
        "lowPerformance": "flat seal glyph retained"
      }
    },
    {
      "epistemicClass": "ai_generated_hypothesis",
      "authorityRank": 2,
      "visualStability": 2,
      "persistent": true,
      "visual": {
        "form": "translucent_projection",
        "label": "title · proposed <date> · by <compiler>",
        "pattern": "wireframe with dashed edges and visible interior; alpha 0.35",
        "motion": "gentle drift; flicker only when unsupported",
        "colourToken": "hypothesisGlass",
        "tether": "dashed tether to what it was derived from",
        "interaction": "select shows proposal, sources, required approval",
        "reducedMotion": "static wireframe",
        "lowPerformance": "wireframe only"
      }
    },
    {
      "epistemicClass": "contested_claim",
      "authorityRank": 4,
      "visualStability": 3,
      "persistent": true,
      "visual": {
        "form": "interference_or_bifurcated_node",
        "label": "claim A ⇄ claim B · contested since <date>",
        "pattern": "two half-structures with a standing interference lattice between them",
        "motion": "slow phase beat between the halves",
        "colourToken": "signalAmber",
        "tether": "both halves keep their own tethers; the field links the two",
        "interaction": "select shows both claims, both sources, authority classes, resolution path",
        "reducedMotion": "static split node with lattice",
        "lowPerformance": "split node retained; lattice simplified to lines"
      }
    },
    {
      "epistemicClass": "superseded_claim",
      "authorityRank": 3,
      "visualStability": 3,
      "persistent": true,
      "visual": {
        "form": "faded_historical_structure_with_successor_link",
        "label": "title · superseded by <id> on <date>",
        "pattern": "desaturated, lower luminance, intact geometry, a directed arrow tether to the successor",
        "motion": "drifts into a historical orbit once; then still",
        "colourToken": "historyAsh",
        "tether": "directed successor tether always visible",
        "interaction": "selectable; shows the evidence or decision that superseded it",
        "reducedMotion": "appears in historical orbit without drift",
        "lowPerformance": "retained; never culled to tidy the galaxy"
      }
    },
    {
      "epistemicClass": "unverified_claim",
      "authorityRank": 2,
      "visualStability": 1,
      "persistent": true,
      "visual": {
        "form": "unstable_object_with_incomplete_tether",
        "label": "title · unverified",
        "pattern": "incomplete geometry with missing facets; tether ends in a frayed stub",
        "motion": "irregular flicker",
        "colourToken": "dustRose",
        "tether": "frayed stub where a source should be",
        "interaction": "select shows what evidence would complete it",
        "reducedMotion": "static incomplete geometry with stub",
        "lowPerformance": "retained"
      }
    },
    {
      "epistemicClass": "live_operational_signal",
      "authorityRank": 6,
      "visualStability": 0,
      "persistent": false,
      "visual": {
        "form": "moving_signal_or_transmission",
        "label": "value · source authority · as of <time>",
        "pattern": "pulse packets along a lane; no body that could be mistaken for a structure",
        "motion": "continuous while live; ends when the signal ends",
        "colourToken": "signalCyan",
        "tether": "none; it points at the authority it came from",
        "interaction": "select opens the Evidence View of the live authority",
        "reducedMotion": "static packet with timestamp; still no persistent body",
        "lowPerformance": "single packet"
      }
    },
    {
      "epistemicClass": "deterministically_verified_fact",
      "authorityRank": 6,
      "visualStability": 8,
      "persistent": true,
      "visual": {
        "form": "structure_with_machine_verification_signature",
        "label": "title · verified <signature prefix> · <date>",
        "pattern": "solid structure carrying a machined signature band; band shape only appears with a signature",
        "motion": "signature band engages once on verification",
        "colourToken": "signalLime",
        "authorityMark": "machine signature band (form)",
        "tether": "continuous tether to the check run or gate decision",
        "interaction": "select shows the check, exit result, timestamp and SHA",
        "reducedMotion": "band present without engagement animation",
        "lowPerformance": "band retained"
      }
    }
  ],
  "tetherStates": {
    "intact": {
      "form": "continuous_line",
      "pattern": "solid",
      "motion": "none",
      "colourToken": "evidenceIce",
      "reducedMotion": "solid line"
    },
    "broken": {
      "form": "frayed_fault_geometry",
      "pattern": "line ends in a jagged break with a fault glyph",
      "motion": "none",
      "colourToken": "faultRed",
      "reducedMotion": "same"
    },
    "stale": {
      "form": "dashed_line_with_hash_mismatch_glyph",
      "pattern": "dashed with a mismatch glyph at the source end",
      "motion": "none",
      "colourToken": "signalAmber",
      "reducedMotion": "same"
    },
    "absent": {
      "form": "stub_only",
      "pattern": "short stub from the claim, no target",
      "motion": "none",
      "colourToken": "dustRose",
      "reducedMotion": "same"
    }
  },
  "invariants": [
    "among persistent classes, visualStability never exceeds that of any class with a strictly higher authorityRank (owner_approved_decision and immutable_raw_evidence are peers at rank 9); live_operational_signal is non-persistent and deliberately unstable",
    "colourToken is never the only difference between two entries",
    "live_operational_signal is the only non-persistent class",
    "only deterministically_verified_fact and owner_approved_decision carry an authorityMark",
    "superseded_claim always renders its successor tether",
    "rendering reads epistemicClass from the graph and never assigns it"
  ]
}
